"Status","Start Time","Stop Time","Duration in ms","Parent Suite","Suite","Sub Suite","Test Class","Test Method","Name","Description"
"passed","Wed Jan 24 15:03:44 IST 2024","Wed Jan 24 15:04:40 IST 2024","56528","Surefire suite","Surefire test","tests.techRo.ServiceManagerPartsRelatedTasks","tests.techRo.ServiceManagerPartsRelatedTasks","Test_004_verifyLabor","Test_004_verify Labor Text ","Test Description: verify Labor Text "
"passed","Wed Jan 24 15:02:34 IST 2024","Wed Jan 24 15:03:44 IST 2024","69693","Surefire suite","Surefire test","tests.techRo.ServiceManagerPartsRelatedTasks","tests.techRo.ServiceManagerPartsRelatedTasks","Test_003_clickOnPart","Test_003_click On part Number","Test Description: click On part Number"
"passed","Wed Jan 24 15:11:17 IST 2024","Wed Jan 24 15:11:41 IST 2024","24404","Surefire suite","Surefire test","tests.techRo.ServiceManagerPartsRelatedTasks","tests.techRo.ServiceManagerPartsRelatedTasks","Test_008_clickOnCloseButton","Test_008_click On Close Button ","Test Description: click On Close Button  "
"passed","Wed Jan 24 15:04:40 IST 2024","Wed Jan 24 15:06:48 IST 2024","127684","Surefire suite","Surefire test","tests.techRo.ServiceManagerPartsRelatedTasks","tests.techRo.ServiceManagerPartsRelatedTasks","Test_005_verifyChargeQuantityEditable","Test_005_verify Charge Quantity Editable  ","Test Description: verify Charge Quantity Editable  "
"passed","Wed Jan 24 14:55:58 IST 2024","Wed Jan 24 15:00:15 IST 2024","256494","Surefire suite","Surefire test","tests.techRo.ServiceManagerPartsRelatedTasks","tests.techRo.ServiceManagerPartsRelatedTasks","Test_001_gotoCompleteRo","Test_001_Login the page and Go to CompleteRo Screen","Test Description: Login the page and Go to CompleteRo Screen"
"passed","Wed Jan 24 15:00:15 IST 2024","Wed Jan 24 15:02:34 IST 2024","138633","Surefire suite","Surefire test","tests.techRo.ServiceManagerPartsRelatedTasks","tests.techRo.ServiceManagerPartsRelatedTasks","Test_002_clickOnReference","Test_002_click On Reference Number","Test Description: click On Reference Number"
"passed","Wed Jan 24 15:06:48 IST 2024","Wed Jan 24 15:09:28 IST 2024","160305","Surefire suite","Surefire test","tests.techRo.ServiceManagerPartsRelatedTasks","tests.techRo.ServiceManagerPartsRelatedTasks","Test_006_clickOnAddPart","Test_006_click On Add Part ","Test Description: click On Add Part   "
"passed","Wed Jan 24 15:09:28 IST 2024","Wed Jan 24 15:11:17 IST 2024","108305","Surefire suite","Surefire test","tests.techRo.ServiceManagerPartsRelatedTasks","tests.techRo.ServiceManagerPartsRelatedTasks","Test_007_clickOnNonCatalogPart","Test_007_click On Non-Catalog Part ","Test Description: click On Non-Catalog Part "
