"Status","Start Time","Stop Time","Duration in ms","Parent Suite","Suite","Sub Suite","Test Class","Test Method","Name","Description"
"passed","Wed Jan 24 12:57:44 IST 2024","Wed Jan 24 12:58:40 IST 2024","56757","Surefire suite","Surefire test","tests.techRo.ServiceManagerPartsRelatedTasks","tests.techRo.ServiceManagerPartsRelatedTasks","Test_004_verifyLabor","Test_004_verify Labor Text ","Test Description: verify Labor Text "
"passed","Wed Jan 24 12:49:44 IST 2024","Wed Jan 24 12:54:07 IST 2024","263456","Surefire suite","Surefire test","tests.techRo.ServiceManagerPartsRelatedTasks","tests.techRo.ServiceManagerPartsRelatedTasks","Test_001_gotoCompleteRo","Test_001_Login the page and Go to CompleteRo Screen","Test Description: Login the page and Go to CompleteRo Screen"
"passed","Wed Jan 24 13:00:48 IST 2024","Wed Jan 24 13:03:29 IST 2024","160377","Surefire suite","Surefire test","tests.techRo.ServiceManagerPartsRelatedTasks","tests.techRo.ServiceManagerPartsRelatedTasks","Test_006_clickOnAddPart","Test_006_click On Add Part ","Test Description: click On Add Part   "
"passed","Wed Jan 24 12:56:26 IST 2024","Wed Jan 24 12:57:43 IST 2024","77095","Surefire suite","Surefire test","tests.techRo.ServiceManagerPartsRelatedTasks","tests.techRo.ServiceManagerPartsRelatedTasks","Test_003_clickOnPart","Test_003_click On part Number","Test Description: click On part Number"
"passed","Wed Jan 24 12:54:07 IST 2024","Wed Jan 24 12:56:26 IST 2024","138902","Surefire suite","Surefire test","tests.techRo.ServiceManagerPartsRelatedTasks","tests.techRo.ServiceManagerPartsRelatedTasks","Test_002_clickOnReference","Test_002_click On Reference Number","Test Description: click On Reference Number"
"passed","Wed Jan 24 13:05:17 IST 2024","Wed Jan 24 13:05:41 IST 2024","24397","Surefire suite","Surefire test","tests.techRo.ServiceManagerPartsRelatedTasks","tests.techRo.ServiceManagerPartsRelatedTasks","Test_008_clickOnCloseButton","Test_008_click On Close Button ","Test Description: click On Close Button  "
"passed","Wed Jan 24 12:58:40 IST 2024","Wed Jan 24 13:00:48 IST 2024","127757","Surefire suite","Surefire test","tests.techRo.ServiceManagerPartsRelatedTasks","tests.techRo.ServiceManagerPartsRelatedTasks","Test_005_verifyChargeQuantityEditable","Test_005_verify Charge Quantity Editable  ","Test Description: verify Charge Quantity Editable  "
"passed","Wed Jan 24 13:03:29 IST 2024","Wed Jan 24 13:05:17 IST 2024","108327","Surefire suite","Surefire test","tests.techRo.ServiceManagerPartsRelatedTasks","tests.techRo.ServiceManagerPartsRelatedTasks","Test_007_clickOnNonCatalogPart","Test_007_click On Non-Catalog Part ","Test Description: click On Non-Catalog Part "
