"Status","Start Time","Stop Time","Duration in ms","Parent Suite","Suite","Sub Suite","Test Class","Test Method","Name","Description"
"skipped","Mon Feb 19 17:51:32 IST 2024","Mon Feb 19 17:51:32 IST 2024","1","Surefire suite","Surefire test","tests.tech.TechWoLabor","tests.tech.TechWoLabor","enter_AccessoriesGroup_Img","T_009 Enter Accessories Group Image","Test Description - Enter Accessories Group Image"
"skipped","Mon Feb 19 17:51:32 IST 2024","Mon Feb 19 17:51:32 IST 2024","1","Surefire suite","Surefire test","tests.tech.TechWoLabor","tests.tech.TechWoLabor","again_Add_AeroDynamicDevice","T_008 Check that again add Aerodynamic Device ","Test Description - Check that again add Aerodynamic Device"
"broken","Thu Feb 22 13:20:45 IST 2024","Thu Feb 22 13:20:45 IST 2024","3","Surefire suite","Surefire test","tests.administration.TransitonedPaccar","tests.administration.TransitonedPaccar","initialization","initialization",""
"passed","Tue Feb 13 15:20:13 IST 2024","Tue Feb 13 15:23:37 IST 2024","204236","Surefire suite","Surefire test","tests.Partsrelateditems.Addafabricatedparttoaclosedworkorder","tests.Partsrelateditems.Addafabricatedparttoaclosedworkorder","Test_005_clickonPartTextArea","Test_005_click on part Text Area","Test Description:click on part Text Area"
"skipped","Thu Feb 22 13:20:46 IST 2024","Thu Feb 22 13:20:46 IST 2024","1","Surefire suite","Surefire test","tests.administration.TransitonedPaccar","tests.administration.TransitonedPaccar","Test_009_vifyTotalCharge","Test_009_verify Part Failure Required","Test Dscription: verify Part Failure Required"
"skipped","Mon Feb 19 17:51:32 IST 2024","Mon Feb 19 17:51:32 IST 2024","1","Surefire suite","Surefire test","tests.tech.TechWoLabor","tests.tech.TechWoLabor","add_AeroDynamic_Delete_Labour","T_007 Check that add AeroDynamic Device and Delete it from Labour section","Test Description - Check that add AeroDynamic Device and Delete it from Labour section"
"skipped","Thu Feb 22 13:20:46 IST 2024","Thu Feb 22 13:20:46 IST 2024","1","Surefire suite","Surefire test","tests.administration.TransitonedPaccar","tests.administration.TransitonedPaccar","Test_007_verifyPartFailureRequired","Test_007_verify Part Failure Required","Test Description: verify Part Failure Required"
"broken","Mon Feb 19 17:51:32 IST 2024","Mon Feb 19 17:51:32 IST 2024","0","Surefire suite","Surefire test","tests.tech.TechWoLabor","tests.tech.TechWoLabor","afterMethodTakeScreenShot","afterMethodTakeScreenShot",""
"skipped","Mon Feb 19 17:51:32 IST 2024","Mon Feb 19 17:51:32 IST 2024","0","Surefire suite","Surefire test","tests.tech.TechWoLabor","tests.tech.TechWoLabor","enter_AeroDynamic_ClickIMG","T_006 Enter Aerodynamic Device and click on Image","Test Description : Enter Aerodynamic Device and click on Image"
"skipped","Mon Feb 19 17:51:32 IST 2024","Mon Feb 19 17:51:32 IST 2024","1","Surefire suite","Surefire test","tests.tech.TechWoLabor","tests.tech.TechWoLabor","enter_AeroDynamic_Device_First","T_005 Enter AderoDynamic Device in search field","Test Description - Enter AderoDynamic Device in search field"
"skipped","Thu Feb 22 13:20:46 IST 2024","Thu Feb 22 13:20:46 IST 2024","1","Surefire suite","Surefire test","tests.administration.TransitonedPaccar","tests.administration.TransitonedPaccar","Test_004_goToCompleteROScreen","Test_004_go To Complete RO Screen","Test Description: go To Complete RO Screen "
"broken","Tue Feb 13 15:23:37 IST 2024","Tue Feb 13 15:23:37 IST 2024","0","Surefire suite","Surefire test","tests.Partsrelateditems.Addafabricatedparttoaclosedworkorder","tests.Partsrelateditems.Addafabricatedparttoaclosedworkorder","generateAllure","generateAllure",""
"passed","Tue Feb 13 15:27:59 IST 2024","Tue Feb 13 15:28:44 IST 2024","44229","Surefire suite","Surefire test","tests.Partsrelateditems.Addafabricatedparttoaclosedworkorder","tests.Partsrelateditems.Addafabricatedparttoaclosedworkorder","Test_001_gotoCompleteRo","Test_001_Login the page and Go to CompleteRo Screen","Test Description: Login the page and Go to CompleteRo Screen"
"skipped","Mon Feb 19 17:51:32 IST 2024","Mon Feb 19 17:51:32 IST 2024","4","Surefire suite","Surefire test","tests.tech.TechWoLabor","tests.tech.TechWoLabor","gotoTechRo","T_001 Login the page and Go to the Tech Ro","Test Description - Login the page and Go to the Tech Ro "
"broken","Mon Feb 19 17:51:32 IST 2024","Mon Feb 19 17:51:32 IST 2024","4","Surefire suite","Surefire test","tests.tech.TechWoLabor","tests.tech.TechWoLabor","initialization","initialization",""
"skipped","Mon Feb 19 17:51:32 IST 2024","Mon Feb 19 17:51:32 IST 2024","0","Surefire suite","Surefire test","tests.tech.TechWoLabor","tests.tech.TechWoLabor","enter_Unit_Number","T_002 Verify the Element and Enter the Unit Number","Test Description - Verify the Element and Enter the Unit Number "
"skipped","Thu Feb 22 13:20:46 IST 2024","Thu Feb 22 13:20:46 IST 2024","1","Surefire suite","Surefire test","tests.administration.TransitonedPaccar","tests.administration.TransitonedPaccar","Test_005_clickOnReferece","Test_005_click On Referece","Test Description: click On Referece"
"skipped","Thu Feb 22 13:20:46 IST 2024","Thu Feb 22 13:20:46 IST 2024","1","Surefire suite","Surefire test","tests.administration.TransitonedPaccar","tests.administration.TransitonedPaccar","Test_003_verifyNewOnPartPosition","Test_003_verify New On Part Position  ","Test Description: verify New On Part Position "
"broken","Mon Feb 19 17:52:02 IST 2024","Mon Feb 19 17:52:02 IST 2024","1","Surefire suite","Surefire test","tests.tech.TechWoLabor","tests.tech.TechWoLabor","generateAllure","generateAllure",""
"broken","Thu Feb 22 13:20:46 IST 2024","Thu Feb 22 13:20:46 IST 2024","0","Surefire suite","Surefire test","tests.administration.TransitonedPaccar","tests.administration.TransitonedPaccar","afterMethodTakeScreenShot","afterMethodTakeScreenShot",""
"skipped","Thu Feb 22 13:20:45 IST 2024","Thu Feb 22 13:20:46 IST 2024","1","Surefire suite","Surefire test","tests.administration.TransitonedPaccar","tests.administration.TransitonedPaccar","Test_002_clickonEquipment","Test_002_click on Equipment ","Test Description: click on Equipment"
"passed","Tue Feb 13 15:28:44 IST 2024","Tue Feb 13 15:31:26 IST 2024","162121","Surefire suite","Surefire test","tests.Partsrelateditems.Addafabricatedparttoaclosedworkorder","tests.Partsrelateditems.Addafabricatedparttoaclosedworkorder","Test_002_clickoNewRo","Test_002_click On New RO","Test Description: click On Reference Number"
"skipped","Thu Feb 22 13:20:45 IST 2024","Thu Feb 22 13:20:45 IST 2024","3","Surefire suite","Surefire test","tests.administration.TransitonedPaccar","tests.administration.TransitonedPaccar","Test_001_gotoStandardCodesScrren","Test_001_Login the page and Go to Standard Codes Screen","Test Description: Login the page and Go to Standard Codes Screen"
"skipped","Thu Feb 22 13:20:46 IST 2024","Thu Feb 22 13:20:46 IST 2024","1","Surefire suite","Surefire test","tests.administration.TransitonedPaccar","tests.administration.TransitonedPaccar","Test_006_verifyPart","Test_006_verify Part","Test Description: verify Part"
"skipped","Mon Feb 19 17:51:32 IST 2024","Mon Feb 19 17:51:32 IST 2024","1","Surefire suite","Surefire test","tests.tech.TechWoLabor","tests.tech.TechWoLabor","clickOn_SelectButton","T_010 Click on Select Button and Again start from Aerodynamic Device ","Test Description - Click on Select Button and Again start from Aerodynamic Device"
"skipped","Mon Feb 19 17:51:32 IST 2024","Mon Feb 19 17:51:32 IST 2024","1","Surefire suite","Surefire test","tests.tech.TechWoLabor","tests.tech.TechWoLabor","verifyElement_Click_UnitHistory","T_003 Verify the element and click on Unit History","Test Description - Verify the element and click on Unit History"
"passed","Tue Feb 13 15:17:36 IST 2024","Tue Feb 13 15:20:13 IST 2024","156592","Surefire suite","Surefire test","tests.Partsrelateditems.Addafabricatedparttoaclosedworkorder","tests.Partsrelateditems.Addafabricatedparttoaclosedworkorder","Test_004_clickonAddPart","Test_004_click on Add Part","Test Description: click on Add Part"
"broken","Tue Feb 13 15:14:58 IST 2024","Tue Feb 13 15:17:36 IST 2024","157962","Surefire suite","Surefire test","tests.Partsrelateditems.Addafabricatedparttoaclosedworkorder","tests.Partsrelateditems.Addafabricatedparttoaclosedworkorder","Test_003_typeSearchTextArea","Test_003_type Search Text Area","Test Description: type Search Text Area"
"skipped","Mon Feb 19 17:51:32 IST 2024","Mon Feb 19 17:51:32 IST 2024","0","Surefire suite","Surefire test","tests.tech.TechWoLabor","tests.tech.TechWoLabor","clickOn_Labour_MoreWork_VMRSTab","T_004 Click on Labour,MoreWork and VMRS tab","Test Description - Click on Labour,MoreWork and VMRS tab"
