"Status","Start Time","Stop Time","Duration in ms","Parent Suite","Suite","Sub Suite","Test Class","Test Method","Name","Description"
"passed","Wed Jan 31 12:27:56 IST 2024","Wed Jan 31 12:28:10 IST 2024","13225","Surefire suite","Surefire test","tests.service.ServiceManagerWoLabor","tests.service.ServiceManagerWoLabor","verifyAllElements","Verify all the WebElements on the web page ","Test Description - Verify all the WebElements on the web page"
"passed","Wed Jan 31 12:36:28 IST 2024","Wed Jan 31 12:37:25 IST 2024","56904","Surefire suite","Surefire test","tests.service.ServiceManagerWoLabor","tests.service.ServiceManagerWoLabor","clickOnTypelink_and_clickOnSelect","Check that click on Type hyperlink, verify the element and click on select button","Test Description - Check that click on Type hyperlink, verify the element and click on select button"
"passed","Wed Jan 31 12:34:42 IST 2024","Wed Jan 31 12:35:31 IST 2024","48751","Surefire suite","Surefire test","tests.service.ServiceManagerWoLabor","tests.service.ServiceManagerWoLabor","clickOnRoStatus_and_CloseButton","Check that click on Ro Status, verify the element and click on close button","Test Description - Check that click on Ro Status, verify the element and click on close button"
"passed","Wed Jan 31 12:37:25 IST 2024","Wed Jan 31 12:38:18 IST 2024","52913","Surefire suite","Surefire test","tests.service.ServiceManagerWoLabor","tests.service.ServiceManagerWoLabor","clickOnInvoiceTohyperlink_and_clickOnCancle","Check that click on InvoiceTo hyperlink, verify element and click on cancle button","Test Description - Check that click on InvoiceTo hyperlink, verify element and click on cancle button"
"passed","Wed Jan 31 12:39:07 IST 2024","Wed Jan 31 12:39:51 IST 2024","44571","Surefire suite","Surefire test","tests.service.ServiceManagerWoLabor","tests.service.ServiceManagerWoLabor","clickOn_ShowLabourDetails_Number_ShowPartsDetails","Check that click on Show labour Details,Number and Show parts Details","Test Description -Check that click on Show labour Details,Number and Show parts Details"
"passed","Wed Jan 31 12:39:51 IST 2024","Wed Jan 31 12:40:36 IST 2024","44552","Surefire suite","Surefire test","tests.service.ServiceManagerWoLabor","tests.service.ServiceManagerWoLabor","clickOnBacktoCompleteRo_and_ReferenceNumber","Check that click on Back to Complete RO and reference number","Test Description -Check that click on Back to Complete RO and reference number"
"passed","Wed Jan 31 12:32:31 IST 2024","Wed Jan 31 12:33:40 IST 2024","69073","Surefire suite","Surefire test","tests.service.ServiceManagerWoLabor","tests.service.ServiceManagerWoLabor","clickOnAdd_and_EntertheText","Check that click on Add button and enter the text in name field and save it","Test Description -Check that click on Add button and enter the text in name field and save it"
"passed","Wed Jan 31 12:33:40 IST 2024","Wed Jan 31 12:34:17 IST 2024","36658","Surefire suite","Surefire test","tests.service.ServiceManagerWoLabor","tests.service.ServiceManagerWoLabor","ennterLastName_and_clickOnSelectBtn","Check that enter last name, verify the element and click on select button ","Test Description - Check that enter last name, verify the element and click on select button"
"passed","Wed Jan 31 12:30:00 IST 2024","Wed Jan 31 12:30:58 IST 2024","58832","Surefire suite","Surefire test","tests.service.ServiceManagerWoLabor","tests.service.ServiceManagerWoLabor","clickOnThisIsStandardNote_EnterInternalNote","Check that click on This is Standard Note and enter the text in Internal Note field","Test Description - Check that click on This is Standard Note and enter the text in Internal Note field"
"passed","Wed Jan 31 12:34:17 IST 2024","Wed Jan 31 12:34:42 IST 2024","24993","Surefire suite","Surefire test","tests.service.ServiceManagerWoLabor","tests.service.ServiceManagerWoLabor","verifyElementofMainScreen"," Check that the selected contact is reflected in the main screen","Test Description -  Check that the selected contact is reflected in the main screen"
"passed","Wed Jan 31 12:30:58 IST 2024","Wed Jan 31 12:32:00 IST 2024","61825","Surefire suite","Surefire test","tests.service.ServiceManagerWoLabor","tests.service.ServiceManagerWoLabor","clickOnNotes_and_EnterTextInNoteField","Check that click On Note link, verify the element and enter text in note field and save it ","Test Description -Check that click On Note link, verify the element and enter text in note field and save it "
"passed","Wed Jan 31 12:27:14 IST 2024","Wed Jan 31 12:27:56 IST 2024","42480","Surefire suite","Surefire test","tests.service.ServiceManagerWoLabor","tests.service.ServiceManagerWoLabor","gotoCompleteRoScreen","Login the page and go to the CompleteRo","Test Description -Login the page and go to the CompleteRo"
"passed","Wed Jan 31 12:38:18 IST 2024","Wed Jan 31 12:39:07 IST 2024","48846","Surefire suite","Surefire test","tests.service.ServiceManagerWoLabor","tests.service.ServiceManagerWoLabor","clickViewProfitLoss_and_clickOk","Check that click on View Profit and Loss hyperlink,verify and click Ok","Test Description -Check that click on View Profit and Loss hyperlink,verify and click Ok"
"passed","Wed Jan 31 12:32:00 IST 2024","Wed Jan 31 12:32:31 IST 2024","30666","Surefire suite","Surefire test","tests.service.ServiceManagerWoLabor","tests.service.ServiceManagerWoLabor","verifyAuthorizedBy_and_ClickOnLink","Verify Authorized By and click on the link of Authorized By","Test Description - Verify Authorized By and click on the link of Authorized By"
"passed","Wed Jan 31 12:28:56 IST 2024","Wed Jan 31 12:29:59 IST 2024","63048","Surefire suite","Surefire test","tests.service.ServiceManagerWoLabor","tests.service.ServiceManagerWoLabor","ClickInternalLink_and_EnterText","Check that click on Internal Link and enter the text in Internal Note field","Test Description - Check that click on Internal Link and enter the text in Internal Note field"
"passed","Wed Jan 31 12:40:36 IST 2024","Wed Jan 31 12:41:50 IST 2024","74138","Surefire suite","Surefire test","tests.service.ServiceManagerWoLabor","tests.service.ServiceManagerWoLabor","clickOnUpdateRates_and_SignOut","Check that click on update Rates hyperlink and sign out the page","Test Description -Check that click on update Rates hyperlink and sign out the page"
"passed","Wed Jan 31 12:28:10 IST 2024","Wed Jan 31 12:28:56 IST 2024","46628","Surefire suite","Surefire test","tests.service.ServiceManagerWoLabor","tests.service.ServiceManagerWoLabor","clickOnRONumber_VerifyElements","Click on RO Number and verify the elements","Test Description - Click on RO Number and verify the elements"
"passed","Wed Jan 31 12:35:31 IST 2024","Wed Jan 31 12:36:28 IST 2024","57015","Surefire suite","Surefire test","tests.service.ServiceManagerWoLabor","tests.service.ServiceManagerWoLabor","clickOnWIPStatus_and_clickCancle","Check that click on WIP status, verify the element and click on cancle","Test Description - Check that click on WIP status, verify the element and click on cancle"
