"Status","Start Time","Stop Time","Duration in ms","Parent Suite","Suite","Sub Suite","Test Class","Test Method","Name","Description"
"passed","Wed Jan 24 14:41:38 IST 2024","Wed Jan 24 14:44:20 IST 2024","161172","Surefire suite","Surefire test","tests.techRo.ServiceManagerPartsRelatedTasks","tests.techRo.ServiceManagerPartsRelatedTasks","Test_002_clickOnReference","Test_002_click On Reference Number","Test Description: click On Reference Number"
"passed","Wed Jan 24 14:37:23 IST 2024","Wed Jan 24 14:41:38 IST 2024","255293","Surefire suite","Surefire test","tests.techRo.ServiceManagerPartsRelatedTasks","tests.techRo.ServiceManagerPartsRelatedTasks","Test_001_gotoCompleteRo","Test_001_Login the page and Go to CompleteRo Screen","Test Description: Login the page and Go to CompleteRo Screen"
"broken","Wed Jan 24 14:49:24 IST 2024","Wed Jan 24 14:52:15 IST 2024","170381","Surefire suite","Surefire test","tests.techRo.ServiceManagerPartsRelatedTasks","tests.techRo.ServiceManagerPartsRelatedTasks","Test_008_clickOnCloseButton","Test_008_click On Close Button ","Test Description: click On Close Button  "
"passed","Wed Jan 24 14:45:29 IST 2024","Wed Jan 24 14:46:25 IST 2024","56459","Surefire suite","Surefire test","tests.techRo.ServiceManagerPartsRelatedTasks","tests.techRo.ServiceManagerPartsRelatedTasks","Test_004_verifyLabor","Test_004_verify Labor Text ","Test Description: verify Labor Text "
"passed","Wed Jan 24 14:44:20 IST 2024","Wed Jan 24 14:45:29 IST 2024","69199","Surefire suite","Surefire test","tests.techRo.ServiceManagerPartsRelatedTasks","tests.techRo.ServiceManagerPartsRelatedTasks","Test_003_clickOnPart","Test_003_click On part Number","Test Description: click On part Number"
"broken","Wed Jan 24 14:46:58 IST 2024","Wed Jan 24 14:47:19 IST 2024","21140","Surefire suite","Surefire test","tests.techRo.ServiceManagerPartsRelatedTasks","tests.techRo.ServiceManagerPartsRelatedTasks","Test_006_clickOnAddPart","Test_006_click On Add Part ","Test Description: click On Add Part   "
"broken","Wed Jan 24 14:47:19 IST 2024","Wed Jan 24 14:49:24 IST 2024","124914","Surefire suite","Surefire test","tests.techRo.ServiceManagerPartsRelatedTasks","tests.techRo.ServiceManagerPartsRelatedTasks","Test_007_clickOnNonCatalogPart","Test_007_click On Non-Catalog Part ","Test Description: click On Non-Catalog Part "
"broken","Wed Jan 24 14:46:25 IST 2024","Wed Jan 24 14:46:58 IST 2024","32543","Surefire suite","Surefire test","tests.techRo.ServiceManagerPartsRelatedTasks","tests.techRo.ServiceManagerPartsRelatedTasks","Test_005_verifyChargeQuantityEditable","Test_005_verify Charge Quantity Editable  ","Test Description: verify Charge Quantity Editable  "
