"Status","Start Time","Stop Time","Duration in ms","Parent Suite","Suite","Sub Suite","Test Class","Test Method","Name","Description"
"skipped","Thu Jan 18 15:43:27 IST 2024","Thu Jan 18 15:43:27 IST 2024","1","Surefire suite","Surefire test","tests.fleet.CreateRedTagDMSTest","tests.fleet.CreateRedTagDMSTest","Test_012_verifytextNotes","Test_012_Verify text Notes","Test Description :Verify text Notes"
"skipped","Thu Jan 18 15:44:17 IST 2024","Thu Jan 18 15:44:17 IST 2024","0","Surefire suite","Surefire test","tests.techRo.CreateNonRepairBill_ServiceManagerTest","tests.techRo.CreateNonRepairBill_ServiceManagerTest","Test_003_clickOnNonRepairBill","Test_003_Click on Non Repair Bills ","Test Description: Click on Non Repair Bill  "
"skipped","Thu Jan 18 15:43:59 IST 2024","Thu Jan 18 15:43:59 IST 2024","0","Surefire suite","Surefire test","tests.service.ECServiceManager_AddRemoveLaborTest","tests.service.ECServiceManager_AddRemoveLaborTest","clickOnVMRS_img_AddButton","T_003 Check that click on VMRS, Automatic/Manual Chassis Lubricator, plus icon and add button","Test Description -  click on VMRS, Automatic/Manual Chassis Lubricator, plus icon and add button"
"broken","Thu Jan 18 15:44:02 IST 2024","Thu Jan 18 15:44:02 IST 2024","0","Surefire suite","Surefire test","tests.service.EC_ServiceManager_WoLaborTest","tests.service.EC_ServiceManager_WoLaborTest","initialization","initialization",""
"broken","Thu Jan 18 15:52:12 IST 2024","Thu Jan 18 15:52:12 IST 2024","0","Surefire suite","Surefire test","tests.administration.CreateVendorTest","tests.administration.CreateVendorTest","initialization","initialization",""
"skipped","Thu Jan 18 15:44:19 IST 2024","Thu Jan 18 15:44:19 IST 2024","1","Surefire suite","Surefire test","tests.techRo.CreateNonRepairBill_ServiceManagerTest","tests.techRo.CreateNonRepairBill_ServiceManagerTest","Test_020_verifySearchColumn","Test_018_ verify Search Column )","Test Description: verify Search Column  "
"skipped","Thu Jan 18 15:43:47 IST 2024","Thu Jan 18 15:43:47 IST 2024","1","Surefire suite","Surefire test","tests.parts.CounterSaleTest","tests.parts.CounterSaleTest","add_new_counter_sale","Test_003 click on add new counter sale","Test Description : Click on add new counter sale"
"skipped","Thu Jan 18 15:43:55 IST 2024","Thu Jan 18 15:43:55 IST 2024","0","Surefire suite","Surefire test","tests.service.CreateRoTest","tests.service.CreateRoTest","Test_004_selectServiceProgramAndAdd","Test_004_Select service program and add","Test Description: Select service program and add"
"skipped","Thu Jan 18 15:44:04 IST 2024","Thu Jan 18 15:44:04 IST 2024","0","Surefire suite","Surefire test","tests.service.EC_ServiceManager_WoLaborTest","tests.service.EC_ServiceManager_WoLaborTest","verifyElementofMainScreen"," Check that the selected contact is reflected in the main screen","Test Description -  Check that the selected contact is reflected in the main screen"
"skipped","Thu Jan 18 15:44:13 IST 2024","Thu Jan 18 15:44:13 IST 2024","0","Surefire suite","Surefire test","tests.techRo.cGVTech_WoComplianceTest","tests.techRo.cGVTech_WoComplianceTest","Test_009_clickOnCleanABSConnection"," click the labor button and verify text ,Button","Test Description -click the labor button and verify text ,Button"
"skipped","Thu Jan 18 15:52:28 IST 2024","Thu Jan 18 15:52:28 IST 2024","2","Surefire suite","Surefire test","tests.estimating.ApproveanEstimateDMSTest","tests.estimating.ApproveanEstimateDMSTest","T_005clickOnRejectButton","click On Rejection Button ","Test Description -click On Rejection Button "
"skipped","Thu Jan 18 15:44:03 IST 2024","Thu Jan 18 15:44:03 IST 2024","1","Surefire suite","Surefire test","tests.service.EC_ServiceManager_WoLaborTest","tests.service.EC_ServiceManager_WoLaborTest","verifyAuthorizedBy_and_ClickOnLink","Verify Authorized By and click on the link of Authorized By","Test Description - Verify Authorized By and click on the link of Authorized By"
"skipped","Thu Jan 18 15:43:22 IST 2024","Thu Jan 18 15:43:22 IST 2024","0","Surefire suite","Surefire test","tests.estimating.PerformTheWorkOnAnEstimateTechTest","tests.estimating.PerformTheWorkOnAnEstimateTechTest","T_003clickOnDeleteImg","click On Delete Image ","Test Description -click On Delete Image "
"skipped","Thu Jan 18 15:43:44 IST 2024","Thu Jan 18 15:43:44 IST 2024","1","Surefire suite","Surefire test","tests.nonRepair.ApproveNonRepairBill_DMSTest","tests.nonRepair.ApproveNonRepairBill_DMSTest","clickOnReject","Click reject button and verify element","Test Description - T_004 Click on reject button and verify element "
"skipped","Thu Jan 18 15:44:03 IST 2024","Thu Jan 18 15:44:03 IST 2024","0","Surefire suite","Surefire test","tests.service.EC_ServiceManager_WoLaborTest","tests.service.EC_ServiceManager_WoLaborTest","clickOnAdd_and_EntertheText","Check that click on Add button and enter the text in name field and save it","Test Description -Check that click on Add button and enter the text in name field and save it"
"skipped","Thu Jan 18 15:43:36 IST 2024","Thu Jan 18 15:43:36 IST 2024","0","Surefire suite","Surefire test","tests.LoginTest","tests.LoginTest","login_with_invalid_credential","Test_001 Invalid Login Scenario with wrong username and password","Test Description : Invalid Login."
"broken","Thu Jan 18 15:43:58 IST 2024","Thu Jan 18 15:43:58 IST 2024","1","Surefire suite","Surefire test","tests.service.ECServiceManager_AddRemoveLaborTest","tests.service.ECServiceManager_AddRemoveLaborTest","initialization","initialization",""
"skipped","Thu Jan 18 15:44:12 IST 2024","Thu Jan 18 15:44:12 IST 2024","0","Surefire suite","Surefire test","tests.techRo.cGVTech_WoComplianceTest","tests.techRo.cGVTech_WoComplianceTest","Test_006_VerifyAlertPresent3CS","verify Alert 3cs presentText","Test Description - verify Alert 3cs presentText"
"skipped","Thu Jan 18 15:44:20 IST 2024","Thu Jan 18 15:44:20 IST 2024","0","Surefire suite","Surefire test","tests.techRo.CreateNonRepairBill_ServiceManagerTest","tests.techRo.CreateNonRepairBill_ServiceManagerTest","Test_023_fillNotesContent","Test_021_ Write Note in note content NRB notes )","Test Description:  Write Note in note content NRB notes "
"skipped","Thu Jan 18 15:43:58 IST 2024","Thu Jan 18 15:43:58 IST 2024","3","Surefire suite","Surefire test","tests.service.ECServiceManager_AddRemoveLaborTest","tests.service.ECServiceManager_AddRemoveLaborTest","gotoCompleteRo","T_001 Login the page and go to the complete Ro","Test Description -  Login the page and go to the complete Ro "
"skipped","Thu Jan 18 15:43:27 IST 2024","Thu Jan 18 15:43:27 IST 2024","1","Surefire suite","Surefire test","tests.fleet.CreateRedTagDMSTest","tests.fleet.CreateRedTagDMSTest","Test_013_verifyElementPresentTextAreaofNotes","Test_013_Verify element present Text Area of Notes","Test Description :Verify element present Text Area of Notes"
"skipped","Thu Jan 18 15:43:59 IST 2024","Thu Jan 18 15:43:59 IST 2024","0","Surefire suite","Surefire test","tests.service.ECServiceManager_AddRemoveLaborTest","tests.service.ECServiceManager_AddRemoveLaborTest","clickOnOk_SignOut","T_006 check that click on Ok and Sign out the page","Test Description -  check that click on Ok and Sign out the page"
"skipped","Thu Jan 18 15:43:29 IST 2024","Thu Jan 18 15:43:29 IST 2024","0","Surefire suite","Surefire test","tests.fleet.CreateRedTagDMSTest","tests.fleet.CreateRedTagDMSTest","Test_029_clickonSignOut","Test_029_click on Sign Out","Test Description :click on Sign Out"
"skipped","Thu Jan 18 15:43:44 IST 2024","Thu Jan 18 15:43:44 IST 2024","1","Surefire suite","Surefire test","tests.nonRepair.ApproveNonRepairBill_DMSTest","tests.nonRepair.ApproveNonRepairBill_DMSTest","clickOnToBeRevised","Click To be Revised and verify element","Test Description - T_005 Click To be Revised and verify element"
"skipped","Thu Jan 18 15:44:19 IST 2024","Thu Jan 18 15:44:19 IST 2024","0","Surefire suite","Surefire test","tests.techRo.CreateNonRepairBill_ServiceManagerTest","tests.techRo.CreateNonRepairBill_ServiceManagerTest","Test_018_verifyDescriptionNotesText","Test_016_ verify Description NotesText )","Test Description:verify Description NotesText "
"skipped","Thu Jan 18 15:52:07 IST 2024","Thu Jan 18 15:52:07 IST 2024","0","Surefire suite","Surefire test","tests.administration.CreateCustomerTest","tests.administration.CreateCustomerTest","Test_004_searchnameandclickonSignout","Check the Customer name in search field and sign out the page","Test Description : Check the Customer name in search field and sign out the page"
"skipped","Thu Jan 18 15:52:27 IST 2024","Thu Jan 18 15:52:27 IST 2024","4","Surefire suite","Surefire test","tests.estimating.ApproveanEstimateDMSTest","tests.estimating.ApproveanEstimateDMSTest","T_001clickFXGEstimationNumber","verify and using Login and password credentials","Test Description -verify and using Login and password credentials "
